{
  "schema_version": 2,
  "version": "demo-v2",
  "analysis_kind": "synthetic_demo",
  "estimator": "linear_fixed_effects",
  "title": "Synthetic workflow demonstration",
  "estimand": "Within-firm linear association between x and y in generated panel data",
  "estimate_label": "Coefficient on x",
  "row_id": "row_id",
  "unit": "firm",
  "time": "year",
  "base": {
    "outcome": "y",
    "treatment": "x",
    "required_controls": ["required_control"],
    "fixed_effects": ["firm", "year"],
    "vcov": {"type": "cluster", "cluster": "firm"},
    "filters": []
  },
  "confidence_level": 0.95,
  "dimensions": [
    {
      "name": "controls",
      "label": "Optional controls",
      "options": [
        {"id": "required", "label": "Required only"},
        {"id": "plus_size", "label": "+ size", "add_controls": ["size"]},
        {"id": "plus_size_liquidity", "label": "+ size, liquidity", "add_controls": ["size", "liquidity"]}
      ]
    }
  ],
  "sample_modes": ["available", "common"],
  "preferred": {"controls": "required", "sample_mode": "available"},
  "reference": null,
  "joint_inference": "not_implemented",
  "figure": {"width": 7, "height": 4.5},
  "seed": 20261018
}
