{
  "schema_version": 2,
  "version": "btmr-v1",
  "analysis_kind": "application",
  "estimator": "linear_fixed_effects",
  "title": "Capital flows, real estate, and city growth (Bednarek, te Kaat, Ma and Rebucci, 2021)",
  "estimand": "Effect on city real GDP per capita growth of the lagged GIPS sovereign spread interacted with 2008 real-estate exposure, German cities 2009-2014",
  "estimate_label": "Coefficient on spread x exposure",
  "row_id": "row_id",
  "unit": "city",
  "time": "year",
  "base": {
    "outcome": "growth",
    "treatment": "spread_x_exposure",
    "required_controls": [],
    "fixed_effects": [
      "city",
      "year"
    ],
    "vcov": {
      "type": "cluster",
      "cluster": "city"
    },
    "filters": []
  },
  "confidence_level": 0.95,
  "dimensions": [
    {
      "name": "macro",
      "label": "Macro interaction",
      "options": [
        {
          "id": "none",
          "label": "None",
          "justification": "Table 3, column 2 (no macro interaction)."
        },
        {
          "id": "bund",
          "label": "Bund yield x exposure",
          "justification": "Table 3, column 3; also in the authors' most conservative columns.",
          "add_controls": [
            "bund_x_exposure"
          ]
        },
        {
          "id": "eonia",
          "label": "EONIA x exposure",
          "justification": "Table 3, column 4.",
          "add_controls": [
            "eonia_x_exposure"
          ]
        },
        {
          "id": "policy",
          "label": "ECB rate x exposure",
          "justification": "Table 3, column 5.",
          "add_controls": [
            "policy_x_exposure"
          ]
        },
        {
          "id": "vix",
          "label": "VIX x exposure",
          "justification": "Table 3, column 6.",
          "add_controls": [
            "vix_x_exposure"
          ]
        }
      ]
    },
    {
      "name": "city_size",
      "label": "City-size interaction",
      "options": [
        {
          "id": "none",
          "label": "None",
          "justification": "Table 3, columns 2-6."
        },
        {
          "id": "pop",
          "label": "Spread x population share",
          "justification": "Table 3, column 7.",
          "add_controls": [
            "spread_x_pop"
          ]
        },
        {
          "id": "popdens",
          "label": "Spread x population density",
          "justification": "Table 3, column 8.",
          "add_controls": [
            "spread_x_popdens"
          ]
        }
      ]
    },
    {
      "name": "time_effects",
      "label": "Time effects",
      "options": [
        {
          "id": "year",
          "label": "Year FE",
          "justification": "Published specification."
        },
        {
          "id": "east_year",
          "label": "East-by-year FE",
          "fixed_effects": [
            "city",
            "east_year"
          ],
          "justification": "Allows separate common shocks for eastern and western cities."
        },
        {
          "id": "state_year",
          "label": "State-by-year FE",
          "fixed_effects": [
            "city",
            "state_year"
          ],
          "justification": "Absorbs state-level shocks; identification from cities within the same state."
        }
      ]
    },
    {
      "name": "sample",
      "label": "Sample",
      "options": [
        {
          "id": "all",
          "label": "All 85 cities, 2009-2014",
          "justification": "Published sample."
        },
        {
          "id": "west",
          "label": "Western cities only",
          "filters": [
            {
              "variable": "east",
              "op": "==",
              "value": 0
            }
          ],
          "justification": "Eastern cities followed different post-reunification paths."
        },
        {
          "id": "drop2009",
          "label": "Drop 2009",
          "filters": [
            {
              "variable": "year",
              "op": ">=",
              "value": 2010
            }
          ],
          "justification": "2009 is the trough of the financial crisis."
        }
      ]
    },
    {
      "name": "outcome_def",
      "label": "Outcome",
      "options": [
        {
          "id": "raw",
          "label": "Growth",
          "outcome": "growth",
          "justification": "Published outcome."
        },
        {
          "id": "winsorized",
          "label": "Growth, winsorized 1/99",
          "outcome": "growth_winsorized",
          "justification": "Limits the influence of extreme growth rates (maximum 26.7)."
        }
      ]
    }
  ],
  "sample_modes": [
    "available"
  ],
  "exclusions": [
    {
      "match": {
        "sample": "west",
        "time_effects": "east_year"
      },
      "reason": "Within western cities, East-by-year effects equal year effects (duplicate model)."
    }
  ],
  "preferred": {
    "macro": "bund",
    "city_size": "pop",
    "time_effects": "year",
    "sample": "all",
    "outcome_def": "raw",
    "sample_mode": "available"
  },
  "original_specifications": [
    {
      "macro": "none",
      "city_size": "none",
      "time_effects": "year",
      "sample": "all",
      "outcome_def": "raw",
      "sample_mode": "available"
    },
    {
      "macro": "bund",
      "city_size": "none",
      "time_effects": "year",
      "sample": "all",
      "outcome_def": "raw",
      "sample_mode": "available"
    },
    {
      "macro": "eonia",
      "city_size": "none",
      "time_effects": "year",
      "sample": "all",
      "outcome_def": "raw",
      "sample_mode": "available"
    },
    {
      "macro": "policy",
      "city_size": "none",
      "time_effects": "year",
      "sample": "all",
      "outcome_def": "raw",
      "sample_mode": "available"
    },
    {
      "macro": "vix",
      "city_size": "none",
      "time_effects": "year",
      "sample": "all",
      "outcome_def": "raw",
      "sample_mode": "available"
    },
    {
      "macro": "bund",
      "city_size": "popdens",
      "time_effects": "year",
      "sample": "all",
      "outcome_def": "raw",
      "sample_mode": "available"
    }
  ],
  "reference": {
    "estimate": 0.007,
    "std_error": 0.004,
    "tolerance": 0.0005,
    "source": "Bednarek, te Kaat, Ma and Rebucci (2021), Review of Financial Studies 34(10), Table 3, column 7: 0.007 (0.004), N = 510; the text calls columns 7 and 8 'the most conservative specifications'"
  },
  "joint_inference": "not_implemented",
  "figure": {
    "width": 7.2,
    "height": 6
  },
  "notes": "Self-described most conservative specification example. Menu written before any alternative estimate; selection in Supplementary Material, Section S1. Preferred = Table 3 column 7, the first of the two columns the authors call the most conservative; column 8 is an original specification. City clustering does not address dependence from the single aggregate spread series."
}